{
  "plan_id": "token-diet-plan-v1",
  "source_spec": "docs/specs/token-diet/spec.md",
  "branch": "feat/token-diet",
  "started_at": "2026-07-10T20:25:49.855Z",
  "tasks": {
    "rules-doc": {
      "status": "done",
      "estimated_tokens": 50000,
      "actual_tokens": 38756,
      "deviation": -11244,
      "test_cmd": "node --test plugins/token-diet/test/rules-doc.test.mjs",
      "commit": "6187d36",
      "incidencia": "agentId no obtenido para esta tarea",
      "agentId": null,
      "sessionId": null
    },
    "cmd-base": {
      "status": "done",
      "estimated_tokens": 90000,
      "actual_tokens": 73108,
      "deviation": -16892,
      "test_cmd": "node --test plugins/token-diet/test/cmd-base.test.mjs",
      "commit": "e0a1bf1",
      "incidencia": "agentId no obtenido para esta tarea",
      "agentId": null,
      "sessionId": null
    },
    "cmd-recommend": {
      "status": "done",
      "estimated_tokens": 50000,
      "actual_tokens": 45813,
      "deviation": -4187,
      "test_cmd": "node --test plugins/token-diet/test/cmd-recommend.test.mjs",
      "commit": null,
      "incidencia": "agentId no obtenido para esta tarea",
      "agentId": null,
      "sessionId": null
    },
    "cmd-apply": {
      "status": "pending",
      "estimated_tokens": 60000,
      "actual_tokens": null,
      "deviation": null,
      "test_cmd": null,
      "commit": null,
      "incidencia": null,
      "agentId": null,
      "sessionId": null
    },
    "e2e-verify": {
      "status": "pending",
      "estimated_tokens": 30000,
      "actual_tokens": null,
      "deviation": null,
      "test_cmd": null,
      "commit": null,
      "incidencia": null,
      "agentId": null,
      "sessionId": null
    },
    "semantic-review": {
      "status": "pending",
      "estimated_tokens": 40000,
      "actual_tokens": null,
      "deviation": null,
      "test_cmd": null,
      "commit": null,
      "incidencia": null,
      "agentId": null,
      "sessionId": null
    }
  },
  "pause": null
}
