{
  "plan_id": "forensics-analysis-validate-cli-v1",
  "source_spec": "docs/specs/forensics-analysis-validate-cli/spec.md",
  "branch": "feat/forensics-analysis-validate-cli",
  "started_at": "2026-07-12T20:51:06.909Z",
  "tasks": {
    "cli-entry-point": {
      "status": "done",
      "estimated_tokens": 70000,
      "actual_tokens": 35000,
      "deviation": -35000,
      "test_cmd": "cd plugins/sdd-kit && node --test test/exec/forensics-analysis-validate-cli.test.mjs",
      "commit": "5ffeb4a",
      "incidencia": null,
      "agentId": "ab50d231a6062c0a0",
      "sessionId": "1609f399-042e-416c-8e30-e20233e39d4c"
    },
    "skill-doc-update": {
      "status": "done",
      "estimated_tokens": 40000,
      "actual_tokens": 55000,
      "deviation": 15000,
      "test_cmd": "node --test plugins/sdd-kit/test/exec/spec-forensics-skill-doc.test.mjs",
      "commit": "8ebface",
      "incidencia": null,
      "agentId": "a65436badfac73979",
      "sessionId": "1609f399-042e-416c-8e30-e20233e39d4c"
    },
    "signal-anchoring-multiline-fix": {
      "status": "done",
      "estimated_tokens": 60000,
      "actual_tokens": 30000,
      "deviation": -30000,
      "test_cmd": "node --test plugins/sdd-kit/test/exec/forensics-analysis-validate.test.mjs",
      "commit": "52a5845",
      "incidencia": null,
      "agentId": "a8a8ac27a7ae7af17",
      "sessionId": "1609f399-042e-416c-8e30-e20233e39d4c"
    },
    "e2e-cli-multiline-signal": {
      "status": "done",
      "estimated_tokens": 55000,
      "actual_tokens": 45000,
      "deviation": -10000,
      "test_cmd": "node --test plugins/sdd-kit/test/exec/e2e-forensics-analysis-validate-cli-multiline-signal.test.mjs",
      "commit": null,
      "incidencia": null,
      "agentId": "ae65e9b8f23741601",
      "sessionId": "1609f399-042e-416c-8e30-e20233e39d4c"
    }
  },
  "pause": null
}
