{
  "plan_id": "trim-cli-data-v1",
  "source_spec": "docs/specs/trim-cli-data/spec.md",
  "branch": "refactor/trim-cli-data",
  "started_at": "2026-07-12T22:55:20.029Z",
  "tasks": {
    "T1_field_inventory": {
      "status": "done",
      "estimated_tokens": 80000,
      "actual_tokens": null,
      "deviation": null,
      "test_cmd": "node docs/specs/trim-cli-data/verify-field-inventory.mjs",
      "commit": "86d3ce3",
      "incidencia": "agentId no obtenido para esta tarea",
      "agentId": null,
      "sessionId": "bffecea8-3fb9-4fe9-afce-a8a1715d852b"
    },
    "T2_baseline_measurements": {
      "status": "done",
      "estimated_tokens": 90000,
      "actual_tokens": 104675,
      "deviation": 14675,
      "test_cmd": "node --test plugins/sdd-kit/test/trim-cli-data-baseline-measurements.test.mjs",
      "commit": "cc00c4e",
      "incidencia": null,
      "agentId": "a30e5a7fbf3418200",
      "sessionId": "bffecea8-3fb9-4fe9-afce-a8a1715d852b"
    },
    "T3_contract_doc": {
      "status": "done",
      "estimated_tokens": 60000,
      "actual_tokens": 58102,
      "deviation": -1898,
      "test_cmd": "node --test plugins/sdd-kit/test/trim-cli-data-contract-doc.test.mjs",
      "commit": "84fd35e",
      "incidencia": null,
      "agentId": "a690088684110bd7c",
      "sessionId": "c5b1fc56-1d6a-47ce-80e6-fcf4c7746b26"
    },
    "T4_trim_dead_fields": {
      "status": "done",
      "estimated_tokens": 120000,
      "actual_tokens": 260000,
      "deviation": 140000,
      "test_cmd": "node --test plugins/sdd-kit/test/trim-cli-data-trim-fields.test.mjs && node --test plugins/sdd-kit/test/**/*.test.mjs && bash scripts/validate.sh",
      "commit": "479c33f",
      "incidencia": null,
      "agentId": "aa041f25d9ae7c9f9",
      "sessionId": "c5b1fc56-1d6a-47ce-80e6-fcf4c7746b26"
    },
    "T5_restructure_heavy_payloads": {
      "status": "done",
      "estimated_tokens": 130000,
      "actual_tokens": 220000,
      "deviation": 90000,
      "test_cmd": "node --test plugins/sdd-kit/test/trim-cli-data-restructure-findings.test.mjs && node --test plugins/sdd-kit/test/**/*.test.mjs && bash scripts/validate.sh",
      "commit": "a67decf",
      "incidencia": null,
      "agentId": "a5d7aa6b4af4c0d24",
      "sessionId": "c5b1fc56-1d6a-47ce-80e6-fcf4c7746b26"
    },
    "T6_contract_annotations": {
      "status": "done",
      "estimated_tokens": 30000,
      "actual_tokens": 90902,
      "deviation": 60902,
      "test_cmd": "node --test plugins/sdd-kit/test/trim-cli-data-contract-annotations.test.mjs",
      "commit": "48fa3a7",
      "incidencia": null,
      "agentId": "aad4f60b85e58fbb6",
      "sessionId": "c5b1fc56-1d6a-47ce-80e6-fcf4c7746b26"
    },
    "T7_after_measurements": {
      "status": "done",
      "estimated_tokens": 40000,
      "actual_tokens": 46975,
      "deviation": 6975,
      "test_cmd": "node --test plugins/sdd-kit/test/trim-cli-data-after-measurements.test.mjs",
      "commit": "c87f9e2",
      "incidencia": null,
      "agentId": "ad3db18c5590882ef",
      "sessionId": "c5b1fc56-1d6a-47ce-80e6-fcf4c7746b26"
    },
    "T8_e2e_green_gate": {
      "status": "done",
      "estimated_tokens": 30000,
      "actual_tokens": 50752,
      "deviation": 20752,
      "test_cmd": "bash scripts/validate.sh && node --test plugins/sdd-kit/test/**/*.test.mjs",
      "commit": "20fd8a3",
      "incidencia": null,
      "agentId": "af3f050f1d9e7e14d",
      "sessionId": "c5b1fc56-1d6a-47ce-80e6-fcf4c7746b26"
    }
  },
  "pause": null
}
