{
  "plan_id": "forensics-persist-ids-v1",
  "source_spec": "docs/specs/forensics-persist-ids/spec.md",
  "branch": "fix/forensics-persist-ids",
  "started_at": "2026-07-11T22:13:09.165Z",
  "tasks": {
    "t1-auto-default-sessionid": {
      "status": "done",
      "estimated_tokens": 45000,
      "actual_tokens": 59447,
      "deviation": 14447,
      "test_cmd": "cd /Users/dmarchena/ai/agent-plugins/plugins/sdd-kit && node --test test/exec/session-id-env-default.test.mjs test/exec/agentid-persist.test.mjs",
      "commit": "c2bf681",
      "incidencia": null,
      "agentId": "a2dc339b6cc1dbd48",
      "sessionId": null
    },
    "t2-wire-agentid-contract": {
      "status": "done",
      "estimated_tokens": 25000,
      "actual_tokens": 41630,
      "deviation": 16630,
      "test_cmd": "cd /Users/dmarchena/ai/agent-plugins && grep -q \"agentId\" plugins/sdd-kit/skills/plan-executor/SKILL.md && grep -q -- \"--agent-id\" plugins/sdd-kit/skills/plan-executor/SKILL.md && ! grep -q -- \"--session-id\" plugins/sdd-kit/skills/plan-executor/SKILL.md",
      "commit": "346c79d",
      "incidencia": null,
      "agentId": "a78e5034a7b2888a6",
      "sessionId": null
    },
    "t3-e2e-forensics-resolves": {
      "status": "done",
      "estimated_tokens": 50000,
      "actual_tokens": 61893,
      "deviation": 11893,
      "test_cmd": "cd /Users/dmarchena/ai/agent-plugins/plugins/sdd-kit && node --test test/exec/e2e-complete-agentid-sessionid.test.mjs",
      "commit": null,
      "incidencia": null,
      "agentId": "a3d8c89f125d2a724",
      "sessionId": null
    }
  },
  "pause": null
}
