{
  "plan_id": "token-estimator-calibration",
  "source_spec": "docs/specs/token-estimator-calibration/spec.md",
  "branch": "feat/token-estimator-calibration",
  "started_at": "2026-07-13T11:30:51.243Z",
  "tasks": {
    "snapshot-command": {
      "status": "done",
      "estimated_tokens": 45000,
      "actual_tokens": 95000,
      "deviation": 50000,
      "test_cmd": "node --test plugins/sdd-kit/test/calibration-snapshot-cli.test.mjs",
      "commit": "aae6018",
      "incidencia": null,
      "agentId": "a6c1c09c82b7b82e3",
      "sessionId": "ecc4e14b-8aac-4a28-9930-d2335c5c7f5e"
    },
    "bias-summary": {
      "status": "done",
      "estimated_tokens": 28000,
      "actual_tokens": 45000,
      "deviation": 17000,
      "test_cmd": "node --test plugins/sdd-kit/test/calibration-snapshot-cli.test.mjs",
      "commit": "4514b38",
      "incidencia": null,
      "agentId": "a12c7cc6d50d764da",
      "sessionId": "ecc4e14b-8aac-4a28-9930-d2335c5c7f5e"
    },
    "deterministic-output": {
      "status": "done",
      "estimated_tokens": 22000,
      "actual_tokens": 35000,
      "deviation": 13000,
      "test_cmd": "node --test plugins/sdd-kit/test/calibration-snapshot-cli.test.mjs",
      "commit": "d82febd",
      "incidencia": null,
      "agentId": "a25893b496a3967f0",
      "sessionId": "ecc4e14b-8aac-4a28-9930-d2335c5c7f5e"
    },
    "generate-snapshot-artifact": {
      "status": "done",
      "estimated_tokens": 8000,
      "actual_tokens": 2000,
      "deviation": -6000,
      "test_cmd": "node plugins/sdd-kit/scripts/plan-tools.mjs calibration-snapshot docs/specs/archived --out /tmp/claude-1001/-home-marchena-Documentos-dmarchena-agent-plugins/ecc4e14b-8aac-4a28-9930-d2335c5c7f5e/scratchpad/regen-verify.md >/dev/null && diff plugins/sdd-kit/skills/plan-writer/assets/calibration-snapshot.md /tmp/claude-1001/-home-marchena-Documentos-dmarchena-agent-plugins/ecc4e14b-8aac-4a28-9930-d2335c5c7f5e/scratchpad/regen-verify.md",
      "commit": "29628e0",
      "incidencia": null,
      "agentId": "a9c0a3f360293f967",
      "sessionId": "ecc4e14b-8aac-4a28-9930-d2335c5c7f5e"
    },
    "estimation-guidance": {
      "status": "done",
      "estimated_tokens": 20000,
      "actual_tokens": 15000,
      "deviation": -5000,
      "test_cmd": "node --test plugins/sdd-kit/test/estimation-guidance-calibration-link.test.mjs",
      "commit": "799f863",
      "incidencia": null,
      "agentId": "a424c6b31182ad07c",
      "sessionId": "ecc4e14b-8aac-4a28-9930-d2335c5c7f5e"
    },
    "e2e-calibration-loop": {
      "status": "done",
      "estimated_tokens": 15000,
      "actual_tokens": 12000,
      "deviation": -3000,
      "test_cmd": "node --test plugins/sdd-kit/test/calibration-snapshot-cli.test.mjs plugins/sdd-kit/test/estimation-guidance-calibration-link.test.mjs",
      "commit": "0012d8d",
      "incidencia": null,
      "agentId": "abeb3f04e6b0de702",
      "sessionId": "ecc4e14b-8aac-4a28-9930-d2335c5c7f5e"
    }
  },
  "pause": null
}
