{
  "plan_id": "token-diet-rules-1-3-0",
  "source_spec": "docs/specs/token-diet-rules-1-3-0/spec.md",
  "branch": "feat/token-diet-rules-1-3-0",
  "started_at": "2026-07-13T22:07:25.648Z",
  "tasks": {
    "t1-rename-rules-doc": {
      "status": "done",
      "estimated_tokens": 15000,
      "actual_tokens": 22000,
      "deviation": 7000,
      "test_cmd": "node --test plugins/token-diet/test/rules-doc.test.mjs",
      "commit": "349b410",
      "incidencia": null,
      "agentId": "a39d74535463a01af",
      "sessionId": "40c24ad5-9b5e-419c-978f-052e054b4301"
    },
    "t2-extend-base-block": {
      "status": "done",
      "estimated_tokens": 25000,
      "actual_tokens": 35000,
      "deviation": 10000,
      "test_cmd": "node --test plugins/token-diet/test/rules-doc-base-block.test.mjs",
      "commit": "6274841",
      "incidencia": null,
      "agentId": "a2b8e840a74eac0c2",
      "sessionId": "40c24ad5-9b5e-419c-978f-052e054b4301"
    },
    "t3-add-detail-section": {
      "status": "done",
      "estimated_tokens": 28000,
      "actual_tokens": 28000,
      "deviation": 0,
      "test_cmd": "node --test plugins/token-diet/test/rules-doc-detail-section.test.mjs",
      "commit": null,
      "incidencia": null,
      "agentId": "a9c45a700a37de960",
      "sessionId": "40c24ad5-9b5e-419c-978f-052e054b4301"
    },
    "t4-version-bump": {
      "status": "pending",
      "estimated_tokens": 20000,
      "actual_tokens": null,
      "deviation": null,
      "test_cmd": null,
      "commit": null,
      "incidencia": null,
      "agentId": null,
      "sessionId": null
    },
    "t5-update-tests": {
      "status": "pending",
      "estimated_tokens": 45000,
      "actual_tokens": null,
      "deviation": null,
      "test_cmd": null,
      "commit": null,
      "incidencia": null,
      "agentId": null,
      "sessionId": null
    },
    "t6-e2e-consistency": {
      "status": "pending",
      "estimated_tokens": 18000,
      "actual_tokens": null,
      "deviation": null,
      "test_cmd": null,
      "commit": null,
      "incidencia": null,
      "agentId": null,
      "sessionId": null
    }
  },
  "pause": null
}
