{
  "plan_id": "token-diet-plan-v1",
  "source_spec": "docs/specs/token-diet/spec.md",
  "branch": "feat/token-diet",
  "started_at": "2026-07-10T20:25:49.855Z",
  "tasks": {
    "rules-doc": {
      "status": "done",
      "estimated_tokens": 50000,
      "actual_tokens": 38756,
      "deviation": -11244,
      "test_cmd": "node --test plugins/token-diet/test/rules-doc.test.mjs",
      "commit": "6187d36",
      "incidencia": "agentId no obtenido para esta tarea",
      "agentId": "a4abdfc2452099221",
      "sessionId": "714f71c3-b3c0-462c-8e30-4ad77168d9b2"
    },
    "cmd-base": {
      "status": "done",
      "estimated_tokens": 90000,
      "actual_tokens": 73108,
      "deviation": -16892,
      "test_cmd": "node --test plugins/token-diet/test/cmd-base.test.mjs",
      "commit": "e0a1bf1",
      "incidencia": "agentId no obtenido para esta tarea",
      "agentId": "a12a9de3904f3e317",
      "sessionId": "714f71c3-b3c0-462c-8e30-4ad77168d9b2"
    },
    "cmd-recommend": {
      "status": "done",
      "estimated_tokens": 50000,
      "actual_tokens": 45813,
      "deviation": -4187,
      "test_cmd": "node --test plugins/token-diet/test/cmd-recommend.test.mjs",
      "commit": "6108807",
      "incidencia": "agentId no obtenido para esta tarea",
      "agentId": "acdb22120c5596f82",
      "sessionId": "714f71c3-b3c0-462c-8e30-4ad77168d9b2"
    },
    "cmd-apply": {
      "status": "done",
      "estimated_tokens": 60000,
      "actual_tokens": 52496,
      "deviation": -7504,
      "test_cmd": "node --test plugins/token-diet/test/cmd-apply.test.mjs",
      "commit": "d8de5ef",
      "incidencia": "agentId no obtenido para esta tarea",
      "agentId": "a8ea7f3ec8c1a87c8",
      "sessionId": "714f71c3-b3c0-462c-8e30-4ad77168d9b2"
    },
    "e2e-verify": {
      "status": "done",
      "estimated_tokens": 30000,
      "actual_tokens": 27934,
      "deviation": -2066,
      "test_cmd": "node --test plugins/token-diet/test/*.test.mjs",
      "commit": "7dc509c",
      "incidencia": "agentId no obtenido para esta tarea",
      "agentId": "a189bad2b609a500d",
      "sessionId": "714f71c3-b3c0-462c-8e30-4ad77168d9b2"
    },
    "semantic-review": {
      "status": "done",
      "estimated_tokens": 40000,
      "actual_tokens": 46766,
      "deviation": 6766,
      "test_cmd": "node --test plugins/token-diet/test/semantic-review.test.mjs",
      "commit": "948e7ae",
      "incidencia": "agentId no obtenido para esta tarea",
      "agentId": "aee4b21044b7bf103",
      "sessionId": "714f71c3-b3c0-462c-8e30-4ad77168d9b2"
    }
  },
  "pause": null
}
