{
  "plan_id": "spec-forensics-report-delegation",
  "source_spec": "docs/specs/spec-forensics-report-delegation/spec.md",
  "branch": "feat/spec-forensics-report-delegation",
  "started_at": "2026-07-12T22:18:43.930Z",
  "tasks": {
    "T1": {
      "status": "done",
      "estimated_tokens": 40000,
      "actual_tokens": 56114,
      "deviation": 16114,
      "test_cmd": "node --test plugins/sdd-kit/test/exec/spec-forensics-report-delegation-skill-doc.test.mjs",
      "commit": "6534f12",
      "incidencia": null,
      "agentId": "a6b9fb505bccfc5dc",
      "sessionId": "79c93042-2fab-4b1a-821e-3c7dc1efceb9"
    },
    "T2": {
      "status": "done",
      "estimated_tokens": 35000,
      "actual_tokens": 59694,
      "deviation": 24694,
      "test_cmd": "node --test plugins/sdd-kit/test/exec/spec-forensics-report-delegation-skill-doc.test.mjs",
      "commit": "25fc937",
      "incidencia": null,
      "agentId": "a8ab9d1c8f21dad62",
      "sessionId": "79c93042-2fab-4b1a-821e-3c7dc1efceb9"
    },
    "T3": {
      "status": "done",
      "estimated_tokens": 15000,
      "actual_tokens": 23045,
      "deviation": 8045,
      "test_cmd": "node --test plugins/sdd-kit/test/exec/spec-forensics-report-delegation-skill-doc.test.mjs",
      "commit": "429d8f1",
      "incidencia": null,
      "agentId": "a2525d7f8e4892d99",
      "sessionId": "79c93042-2fab-4b1a-821e-3c7dc1efceb9"
    }
  },
  "pause": null
}
