{
  "plan_id": "multi-platform-marketplace-v1",
  "source_spec": "docs/specs/multi-platform-marketplace/spec.md",
  "branch": "feat/multi-platform-marketplace",
  "started_at": "2026-07-11T23:42:45.568Z",
  "tasks": {
    "t1-enrich-marketplace": {
      "status": "done",
      "estimated_tokens": 30000,
      "actual_tokens": 38710,
      "deviation": 8710,
      "test_cmd": "node --test scripts/test/marketplace-metadata.test.mjs",
      "commit": "2da536d",
      "incidencia": null,
      "agentId": "a4f943293f265dd74",
      "sessionId": "fd2cb04c-16c6-479c-a9ea-6f7a4d0d59fd"
    },
    "t2-generator-derive": {
      "status": "done",
      "estimated_tokens": 120000,
      "actual_tokens": 76780,
      "deviation": -43220,
      "test_cmd": "node --test scripts/test/generate-cross-platform.test.mjs",
      "commit": "be8232c",
      "incidencia": null,
      "agentId": "a17bb346ee853c2b6",
      "sessionId": "fd2cb04c-16c6-479c-a9ea-6f7a4d0d59fd"
    },
    "t3-llmstxt": {
      "status": "done",
      "estimated_tokens": 25000,
      "actual_tokens": 41598,
      "deviation": 16598,
      "test_cmd": "node --test scripts/test/llms-txt.test.mjs",
      "commit": "e53a60f",
      "incidencia": null,
      "agentId": "a7bd677ab3b83c7c0",
      "sessionId": "fd2cb04c-16c6-479c-a9ea-6f7a4d0d59fd"
    },
    "t4-contributor-docs": {
      "status": "done",
      "estimated_tokens": 40000,
      "actual_tokens": 43390,
      "deviation": 3390,
      "test_cmd": "node --test scripts/test/contributor-docs.test.mjs",
      "commit": null,
      "incidencia": null,
      "agentId": "a404c72f074cadf34",
      "sessionId": "fd2cb04c-16c6-479c-a9ea-6f7a4d0d59fd"
    },
    "t5-scaffold-create": {
      "status": "pending",
      "estimated_tokens": 90000,
      "actual_tokens": null,
      "deviation": null,
      "test_cmd": null,
      "commit": null,
      "incidencia": null,
      "agentId": null,
      "sessionId": null
    },
    "t6-e2e-verify": {
      "status": "pending",
      "estimated_tokens": 30000,
      "actual_tokens": null,
      "deviation": null,
      "test_cmd": null,
      "commit": null,
      "incidencia": null,
      "agentId": null,
      "sessionId": null
    }
  },
  "pause": null
}
